{
  "_D": "urn:oasis:names:specification:ubl:schema:xsd:StockAvailabilityReport-2",
  "_A": "urn:oasis:names:specification:ubl:schema:xsd:CommonAggregateComponents-2",
  "_B": "urn:oasis:names:specification:ubl:schema:xsd:CommonBasicComponents-2",
  "StockAvailabilityReport": {
    "UBLVersionID": { "_": "2.1" },
    "ID": { "_": "SA2009" },
    "CopyIndicator": { "_": false },
    "IssueDate": { "_": "2010-04-11" },
    "Note": [
      {
        "_": "Report about quantities of each item which are (or will be) available"
      }
    ],
    "InventoryPeriod": {
      "StartDate": { "_": "2010-04-11" },
      "StartTime": { "_": "08:00:00Z" },
      "EndDate": { "_": "2011-04-11" }
    },
    "SellerSupplierParty": {
      "Party": {
        "PartyName": [
          {
            "Name": { "_": "Arancio Forniture spa" }
          }
        ],
        "PostalAddress": {
          "StreetName": { "_": "Via Dell'Arcoveggio" },
          "BuildingNumber": { "_": "403" },
          "CityName": { "_": "Bologna" },
          "PostalZone": { "_": "40129" },
          "Country": {
            "IdentificationCode": { "_": "IT" },
            "Name": { "_": "Italy" }
          }
        },
        "Contact": {
          "Name": { "_": "Mr Rossi" },
          "Telephone": { "_": "0039 051 23000000" },
          "Telefax": { "_": "0039 051 23000023" },
          "ElectronicMail": { "_": "rossi@arancioforniture.it" }
        }
      }
    },
    "RetailerCustomerParty": {
      "Party": {
        "PartyName": [
          {
            "Name": { "_": "Beta Shop" }
          }
        ],
        "PostalAddress": {
          "StreetName": { "_": "Via Emilia" },
          "BuildingNumber": { "_": "1" },
          "CityName": { "_": "Modena" },
          "PostalZone": { "_": "41121" },
          "Country": {
            "IdentificationCode": { "_": "IT" },
            "Name": { "_": "Italy" }
          }
        },
        "Contact": {
          "Name": { "_": "Mr Delta" },
          "Telephone": { "_": "0039 059 33000000" },
          "Telefax": { "_": "0039 059 33000055" },
          "ElectronicMail": { "_": "delta@betashop.it" }
        }
      }
    },
    "InventoryReportingParty": {
      "PartyName": [
        {
          "Name": { "_": "Beta Shop" }
        }
      ],
      "PostalAddress": {
        "Floor": { "_": "2" },
        "Room": { "_": "309" },
        "StreetName": { "_": "Via Emilia" },
        "BuildingNumber": { "_": "1" },
        "CityName": { "_": "Modena" },
        "PostalZone": { "_": "41121" },
        "Country": {
          "IdentificationCode": { "_": "IT" },
          "Name": { "_": "Italy" }
        }
      },
      "Contact": {
        "Name": { "_": "Mr Gamma" },
        "Telephone": { "_": "0039 059 33000022" },
        "Telefax": { "_": "0039 059 33000057" },
        "ElectronicMail": { "_": "gamma@betashop.it" }
      }
    },
    "StockAvailabilityReportLine": [
      {
        "ID": { "_": "1" },
        "Quantity": { "_": 50, "unitCode": "NAR" },
        "AvailabilityDate": { "_": "2010-04-20" },
        "AvailabilityStatusCode": {
          "_": "1",
          "listID": "7011",
          "listAgencyName": "UN/ECE",
          "listURI": "http://www.unece.org/trade/untdid/d09b/tred/tred7011.htm"
        },
        "Item": {
          "Description": [{ "_": "T-shirt" }],
          "BuyersItemIdentification": {
            "ID": { "_": "TT319" }
          },
          "SellersItemIdentification": {
            "ID": { "_": "ZZ738" }
          }
        }
      },
      {
        "ID": { "_": "2" },
        "Quantity": { "_": 80, "unitCode": "NAR" },
        "AvailabilityDate": { "_": "2010-04-11" },
        "AvailabilityStatusCode": {
          "_": "2",
          "listID": "7011",
          "listAgencyName": "UN/ECE",
          "listURI": "http://www.unece.org/trade/untdid/d09b/tred/tred7011.htm"
        },
        "Item": {
          "Description": [{ "_": "jersey" }],
          "BuyersItemIdentification": {
            "ID": { "_": "TJ043" }
          },
          "SellersItemIdentification": {
            "ID": { "_": "K0058" }
          }
        }
      },
      {
        "ID": { "_": "3" },
        "Quantity": { "_": 0, "unitCode": "NAR" },
        "AvailabilityStatusCode": {
          "_": "8",
          "listID": "7011",
          "listAgencyName": "UN/ECE",
          "listURI": "http://www.unece.org/trade/untdid/d09b/tred/tred7011.htm"
        },
        "Item": {
          "Description": [{ "_": "skirt" }],
          "BuyersItemIdentification": {
            "ID": { "_": "TS893" }
          },
          "SellersItemIdentification": {
            "ID": { "_": "PK009" }
          }
        }
      }
    ]
  }
}
